{
  "schema": "whipplescript.acceptance_fixture.v0",
  "workflow": "human-review.whip",
  "provider": "fixture",
  "include_tags": [
    "acceptance"
  ],
  "expect": {
    "dev_status": "success",
    "workflow": "HumanReview",
    "status": "passed",
    "source_metadata": {
      "targets": [
        {
          "target_kind": "workflow",
          "target": "HumanReview",
          "tags": [
            "fixture",
            "acceptance"
          ],
          "description": "Fixture-backed human review inbox workflow"
        },
        {
          "target_kind": "table",
          "target": "manual_review_requests",
          "tags": [
            "fixture"
          ],
          "description": "Static manual review request"
        },
        {
          "target_kind": "assertion",
          "target": "cfd9e8fa258fa0f1",
          "tags": [
            "acceptance"
          ],
          "description": "Manual review creates one pending inbox request"
        },
        {
          "target_kind": "rule",
          "target": "request_manual_review",
          "description": "Create a human inbox item for a queued review request"
        }
      ]
    },
    "diagnostics": 0,
    "assertions": {
      "total": 1,
      "passed": 1,
      "failed": 0,
      "error": 0
    },
    "assertion_tags": [
      {
        "tag": "acceptance",
        "total": 1,
        "passed": 1,
        "failed": 0,
        "error": 0
      }
    ],
    "assertion_reads": [
      {
        "source": "effect:kind human.ask where status == completed",
        "match_count": 1,
        "matches": [
          {
            "name": "human.ask",
            "status": "completed",
            "prompt_content_type": "markdown",
            "trace_items": 4,
            "evidence_items": 1,
            "trace_sequences": [
              1,
              2,
              3,
              4
            ],
            "count": 1
          }
        ]
      }
    ],
    "trace": {
      "conformance": {
        "ok": true
      },
      "summary": {
        "events": 8,
        "abstract_events": 4
      },
      "groups": [
        {
          "type": "effect_created",
          "count": 1
        },
        {
          "type": "effect_claimed",
          "count": 1
        },
        {
          "type": "run_started",
          "count": 1
        },
        {
          "type": "effect_terminal",
          "count": 1
        }
      ],
      "items": [
        {
          "sequence": 1,
          "type": "effect_created",
          "status": "queued"
        },
        {
          "sequence": 2,
          "type": "effect_claimed"
        },
        {
          "sequence": 3,
          "type": "run_started"
        },
        {
          "sequence": 4,
          "type": "effect_terminal",
          "status": "completed"
        }
      ]
    },
    "summary": {
      "facts": 2,
      "effects": 1
    },
    "effects": [
      {
        "kind": "human.ask",
        "status": "completed",
        "count": 1
      }
    ],
    "facts": [
      {
        "name": "human.ask.created",
        "count": 1
      },
      {
        "name": "human.ask.issued",
        "count": 1
      }
    ],
    "inbox": [
      {
        "status": "pending",
        "severity": "normal",
        "count": 1
      }
    ],
    "runs": [
      {
        "provider": "fixture",
        "status": "completed",
        "count": 1,
        "artifact_count": 0
      }
    ],
    "evidence": [
      {
        "kind": "human.ask.provider",
        "subject_type": "run",
        "count": 1
      },
      {
        "kind": "rule.committed",
        "subject_type": "rule_commit",
        "count": 2
      }
    ]
  }
}
